{
  "schemaVersion": "1.0.0",
  "experimentId": "rig-v2-gltf-observation-default-node",
  "source": {
    "kind": "gltf-observation",
    "uri": "docs/rig-v2/handoff/mac-observation-v0.1.json",
    "sha256": "cf27f3ff63c5dd73fef0d5ae29657bf296879cd02531f4494ac0d5f173bf117c",
    "gitCommit": "b904b4b200fc838cb7fabbf4ed2ef346faa73b53",
    "producerCommit": "0dbf67ddc886b2ec0482a1e1a38aa84a45222d6c",
    "assetSha256": "ef803a4bbb3c644504c124519e39ba0b3b760ec139eaf60d277ef7f7f5d23274",
    "software": "Three.js 0.180.0",
    "licenseStatus": "Source model terms remain separate; no relicensing by this numeric packet"
  },
  "coordinates": {
    "lengthUnit": "m",
    "timeUnit": "s",
    "handedness": "right",
    "axes": {
      "x": "numeric X; anatomical axes uncalibrated",
      "y": "up",
      "z": "numeric Z"
    },
    "matrixStorage": "column-major-16",
    "vectorConvention": "column-vectors",
    "transformMeaning": "T_parent_from_local; T_world_from_local",
    "rotationConvention": "active-right-handed-matrix"
  },
  "referencePose": {
    "kind": "default-node",
    "description": "Actual default-node; not anatomical calibration; non-bone parent folded into root local",
    "anatomicallyCalibrated": false
  },
  "coverage": {
    "sides": [
      "left",
      "right",
      "midline"
    ],
    "mirrored": false,
    "independentlyValidated": false
  },
  "evidence": {
    "type": "script-derived",
    "confidence": "high-numerical",
    "uncertainties": [
      "Authored diagnostic trajectories, not measured physiological motion",
      "Anatomical axes, joint centres and attachments uncalibrated"
    ]
  },
  "nodes": [
    {
      "id": "Pelvis",
      "parentId": null,
      "side": "midline",
      "localMatrix": [
        1,
        0,
        0,
        0,
        0,
        1,
        0,
        0,
        0,
        0,
        1,
        0,
        0,
        0.800000011920929,
        0.10000000149011612,
        1
      ],
      "worldMatrix": [
        1,
        0,
        0,
        0,
        0,
        1,
        0,
        0,
        0,
        0,
        1,
        0,
        0,
        0.800000011920929,
        0.10000000149011612,
        1
      ],
      "anatomicalAxesKnown": false
    },
    {
      "id": "LeftThigh",
      "parentId": "Pelvis",
      "side": "left",
      "localMatrix": [
        -0.9996544890543926,
        -0.026306541688047982,
        -1.4895316191607433e-06,
        0,
        0.026270267578143283,
        -0.9982730898289722,
        -0.05254075906955885,
        0,
        0.0013806813638156932,
        -0.05252274342734719,
        0.9986210418486511,
        0,
        0.10000000149011612,
        0.029999971389770508,
        0,
        1
      ],
      "worldMatrix": [
        -0.9996544890543926,
        -0.026306541688047982,
        -1.4895316191607433e-06,
        0,
        0.026270267578143283,
        -0.9982730898289722,
        -0.05254075906955885,
        0,
        0.0013806813638156932,
        -0.05252274342734719,
        0.9986210418486511,
        0,
        0.10000000149011612,
        0.8299999833106995,
        0.10000000149011612,
        1
      ],
      "anatomicalAxesKnown": false
    },
    {
      "id": "LeftShin",
      "parentId": "LeftThigh",
      "side": "left",
      "localMatrix": [
        0.9984484357963441,
        -0.055607230488450655,
        -0.002925229720402295,
        0,
        0.055684115164672886,
        0.997069302427664,
        0.0524591865862531,
        0,
        -4.53327023085954e-07,
        -0.05254067848727159,
        0.9986186652979606,
        0,
        -2.0022792313056925e-09,
        0.380657434463501,
        2.2992026060819626e-09,
        1
      ],
      "worldMatrix": [
        -0.9995683165675228,
        0.02939911748696538,
        -1.0370719308850328e-06,
        0,
        -0.029399168903379055,
        -0.9995676102025006,
        -1.337445836718798e-08,
        0,
        -1.0303314687881357e-06,
        -2.3455853923048942e-07,
        1.0000021390797849,
        0,
        0.10999997615384371,
        0.44999990997436345,
        0.07999997323396801,
        1
      ],
      "anatomicalAxesKnown": false
    },
    {
      "id": "LeftAnkle",
      "parentId": "LeftShin",
      "side": "left",
      "localMatrix": [
        0.9995677551493537,
        0.029399028423480956,
        -2.4481596025689424e-07,
        0,
        -0.02939902842349874,
        0.9995677551493808,
        -6.935333749389671e-08,
        0,
        2.4267121909490836e-07,
        7.652071119009895e-08,
        0.9999999999999676,
        0,
        -8.719327482253902e-10,
        0.3401470184326172,
        8.016359132057005e-09,
        1
      ],
      "worldMatrix": [
        -1.000000565311782,
        9.328634127061795e-08,
        -1.2818333419026094e-06,
        0,
        -1.2391393924124123e-07,
        -0.9999998577407536,
        -5.22332559993461e-08,
        0,
        -1.2751475760510728e-06,
        -3.0391184396488846e-07,
        1.0000021390794998,
        0,
        0.09999993737851051,
        0.10999996761653041,
        0.07999997670106306,
        1
      ],
      "anatomicalAxesKnown": false
    },
    {
      "id": "LeftFoot",
      "parentId": "LeftAnkle",
      "side": "left",
      "localMatrix": [
        0.9999999999997861,
        -6.193715936548218e-07,
        2.1055177257616972e-07,
        0,
        -8.499432470574242e-08,
        0.19611597878607753,
        0.9805808910839812,
        0,
        -6.486364827554031e-07,
        -0.9805808910837893,
        0.19611597878598294,
        0,
        7.646602462330065e-09,
        0.04000000283122063,
        -1.742365141055302e-09,
        1
      ],
      "worldMatrix": [
        -1.0000005653117596,
        7.126577828249063e-07,
        -1.0712810865873903e-06,
        0,
        -1.1896924771132385e-06,
        -0.1961162488969209,
        0.980582978380796,
        0,
        5.200676754222982e-07,
        0.9805806919850615,
        0.1961164495134169,
        0,
        0.09999992477534803,
        0.0699999704756813,
        0.079999972869354,
        1
      ],
      "anatomicalAxesKnown": false
    },
    {
      "id": "RightThigh",
      "parentId": "Pelvis",
      "side": "right",
      "localMatrix": [
        -0.9996544890543926,
        0.026306541688047982,
        1.4895316191607433e-06,
        0,
        -0.026270267578143283,
        -0.9982730898289722,
        -0.05254075906955885,
        0,
        -0.0013806813638156932,
        -0.05252274342734719,
        0.9986210418486511,
        0,
        -0.10000000149011612,
        0.029999971389770508,
        0,
        1
      ],
      "worldMatrix": [
        -0.9996544890543926,
        0.026306541688047982,
        1.4895316191607433e-06,
        0,
        -0.026270267578143283,
        -0.9982730898289722,
        -0.05254075906955885,
        0,
        -0.0013806813638156932,
        -0.05252274342734719,
        0.9986210418486511,
        0,
        -0.10000000149011612,
        0.8299999833106995,
        0.10000000149011612,
        1
      ],
      "anatomicalAxesKnown": false
    },
    {
      "id": "RightShin",
      "parentId": "RightThigh",
      "side": "right",
      "localMatrix": [
        0.9984484357963441,
        0.055607230488450655,
        0.002925229720402295,
        0,
        -0.055684115164672886,
        0.997069302427664,
        0.0524591865862531,
        0,
        4.53327023085954e-07,
        -0.05254067848727159,
        0.9986186652979606,
        0,
        2.0022792313056925e-09,
        0.380657434463501,
        2.2992026060819626e-09,
        1
      ],
      "worldMatrix": [
        -0.9995683165675228,
        -0.02939911748696538,
        1.0370719308850328e-06,
        0,
        0.029399168903379055,
        -0.9995676102025006,
        -1.337445836718798e-08,
        0,
        1.0303314687881357e-06,
        -2.3455853923048942e-07,
        1.0000021390797849,
        0,
        -0.10999997615384371,
        0.44999990997436345,
        0.07999997323396801,
        1
      ],
      "anatomicalAxesKnown": false
    },
    {
      "id": "RightAnkle",
      "parentId": "RightShin",
      "side": "right",
      "localMatrix": [
        0.999567755149381,
        -0.029399028423487423,
        6.997037628885827e-08,
        0,
        0.029399028423492273,
        0.9995677551493809,
        -6.935333651492832e-08,
        0,
        -6.790121125839737e-08,
        7.138041995813559e-08,
        0.9999999999999951,
        0,
        8.719327482253902e-10,
        0.3401470184326172,
        8.016359132057005e-09,
        1
      ],
      "worldMatrix": [
        -1.0000005653119897,
        -9.328629459695576e-08,
        1.1069873839259474e-06,
        0,
        1.2391394570829135e-07,
        -0.9999998577407535,
        -5.223325502038231e-08,
        0,
        1.1003018932413259e-06,
        -3.0391185933599986e-07,
        1.0000021390797087,
        0,
        -0.09999993737851051,
        0.10999996761653041,
        0.07999997670106306,
        1
      ],
      "anatomicalAxesKnown": false
    },
    {
      "id": "RightFoot",
      "parentId": "RightAnkle",
      "side": "right",
      "localMatrix": [
        0.9999999999997906,
        -6.119210883173988e-07,
        2.1055231337121586e-07,
        0,
        -8.645601860268746e-08,
        0.19611597878607953,
        0.9805808910839788,
        0,
        -6.413307662086375e-07,
        -0.9805808910837917,
        0.1961159787859856,
        0,
        -6.733058555141724e-09,
        0.04000000283122063,
        8.410261931324214e-10,
        1
      ],
      "worldMatrix": [
        -1.0000005653116244,
        5.186346426796845e-07,
        1.3175401796477429e-06,
        0,
        1.1896925831611064e-06,
        -0.19611624889692192,
        0.980582978380794,
        0,
        7.356102642133597e-07,